accion_sugerida,productos,sobrestock_valorizado,capital_liberado_moderado,ahorro_operativo_anual_moderado,impacto_total_referencial_moderado
Ajustar planificación sin afectar disponibilidad,5,11970800.98,4788320.392,574598.44704,5362918.839040001
Reducir compras y monitorear demanda,2,7836159.22,3134463.688,376135.64256,3510599.33056
Mantener seguimiento,5,5317620.58,2127048.232,255245.78783999998,2382294.01984
"Revisar precio, costo y política de reposición",2,4078425.7199999997,1631370.2880000002,195764.43456000002,1827134.7225600001
Liquidar inventario y retirar del catálogo,1,2100882.96,840353.184,100842.38208,941195.56608
